{
  "apiVersion": "gcac.certification-record/v1",
  "recordId": "migration.linux-systemd-nginx.1.0",
  "baselineRef": "linux-go-full-agent@1.0",
  "recipeRef": "certificate.deploy.linux-systemd-nginx@1.0",
  "environment": {
    "osName": "Linux",
    "osVersion": "profile-fact-not-recorded",
    "kernelOrBuild": "profile-fact-not-recorded",
    "architecture": "amd64",
    "serviceModel": "systemd",
    "privilegeMode": "profile-fact-not-recorded",
    "securityModule": "profile-fact-not-recorded",
    "securityMode": "profile-fact-not-recorded",
    "productName": "product.nginx",
    "productVersion": "profile-fact-not-recorded",
    "certificateFormat": "artifact-codec.pem",
    "transport": "transport.agent-local"
  },
  "agentArtifact": {
    "productLine": "linux-go-full-agent",
    "version": "0.0.0",
    "revision": "migration-v1-profile",
    "sha256": "5743b28f9e4231269d1c346e56b4fa8f4b155bfd31a4f280a9382a03934caa50",
    "signatureVerified": false,
    "vcsModified": true
  },
  "resolvedComposition": {
    "product": "product.nginx",
    "certificate_store": "certificate-store.posix-filesystem",
    "artifact_codec": "artifact-codec.pem",
    "service_controller": "service-controller.systemd",
    "transport": "transport.agent-local",
    "verifier": "verifier.tls-remote",
    "rollback": "rollback.posix-certificate-files"
  },
  "testSuite": "compatibility-profile-v1-migration",
  "results": [
    {
      "testId": "linux.nginx.agent-regression",
      "category": "contract",
      "status": "passed",
      "reference": "agents/linux-go-full-agent/main_test.go"
    },
    {
      "testId": "linux.systemd.apparmor.fixture",
      "category": "contract",
      "status": "passed",
      "reference": "compatibility/fixtures/linux/systemd-apparmor-amd64.json"
    }
  ],
  "status": "passed",
  "observedAt": "2026-07-21T00:00:00.000Z",
  "expiresAt": "2026-10-21T00:00:00.000Z",
  "evidenceReferences": [
    "agents/linux-go-full-agent/main_test.go",
    "compatibility/fixtures/linux/systemd-apparmor-amd64.json"
  ]
}
