{
  "apiVersion": "gcac.certification-record/v1",
  "recordId": "migration.linux-sysv-apache.1.0",
  "baselineRef": "linux-go-full-agent@1.0",
  "recipeRef": "certificate.deploy.linux-sysv-apache@1.0",
  "environment": {
    "osName": "Linux",
    "osVersion": "profile-fact-not-recorded",
    "kernelOrBuild": "profile-fact-not-recorded",
    "architecture": "amd64",
    "serviceModel": "sysv",
    "privilegeMode": "profile-fact-not-recorded",
    "securityModule": "profile-fact-not-recorded",
    "securityMode": "profile-fact-not-recorded",
    "productName": "product.apache",
    "productVersion": "profile-fact-not-recorded",
    "certificateFormat": "artifact-codec.pem",
    "transport": "transport.agent-local"
  },
  "agentArtifact": {
    "productLine": "linux-go-full-agent",
    "version": "0.0.0",
    "revision": "migration-v1-profile",
    "sha256": "ba79fe0de1c8745fa9dacebd9055f58cd2f7f2a4c3aabc2c18223bd9750e3180",
    "signatureVerified": false,
    "vcsModified": true
  },
  "resolvedComposition": {
    "product": "product.apache",
    "certificate_store": "certificate-store.posix-filesystem",
    "artifact_codec": "artifact-codec.pem",
    "service_controller": "service-controller.sysv",
    "transport": "transport.agent-local",
    "verifier": "verifier.tls-remote",
    "rollback": "rollback.posix-certificate-files"
  },
  "testSuite": "compatibility-profile-v1-migration",
  "results": [
    {
      "testId": "linux.sysv.sudo.fixture",
      "category": "contract",
      "status": "passed",
      "reference": "compatibility/fixtures/linux/sysv-sudo-amd64.json"
    },
    {
      "testId": "linux.apache.local-contract",
      "category": "contract",
      "status": "passed",
      "reference": "agents/linux-go-full-agent/internal/handlers/productruntime/runtime_test.go"
    }
  ],
  "status": "passed",
  "observedAt": "2026-07-21T00:00:00.000Z",
  "expiresAt": "2026-10-21T00:00:00.000Z",
  "evidenceReferences": [
    "compatibility/fixtures/linux/sysv-sudo-amd64.json",
    "agents/linux-go-full-agent/internal/handlers/productruntime/runtime_test.go"
  ]
}
